{
  "run_id": "20260212-213717",
  "agent_id": "area-auditor",
  "task_id": "AREA-06_BACKEND",
  "repo_root": "/Users/kanggyeonggu/Documents/league-of-algologic",
  "mode": "full",
  "changed_files": [],
  "target": {
    "kind": "area",
    "id": "06_BACKEND",
    "scope_paths": [
      "06_BACKEND"
    ],
    "checks": [
      "required_docs",
      "broken_links",
      "architecture_rule_consistency",
      "test_rule_coverage_statements"
    ],
    "objective": "Validate backend spec rules and architecture boundaries."
  },
  "severity_policy": {
    "fail_on": "high"
  },
  "output_path": "/Users/kanggyeonggu/Documents/league-of-algologic/AGENTS/CODEX/reports/ssot-spec-audit/20260212-213717/worker_results/AREA-06_BACKEND.worker.json"
}
