{
  "run_id": "20260212-210456",
  "agent_id": "relation-auditor",
  "task_id": "REL-PRODUCT-API",
  "repo_root": "/Users/kanggyeonggu/Documents/league-of-algologic",
  "mode": "full",
  "changed_files": [],
  "target": {
    "kind": "relation",
    "id": "PRODUCT_API",
    "scope_paths": [
      "01_PRODUCT",
      "03_API"
    ],
    "checks": [
      "required_link_presence",
      "requirement_to_contract_mapping",
      "duplication_and_conflict"
    ],
    "objective": "Ensure user/product requirements are traceable to API contracts."
  },
  "severity_policy": {
    "fail_on": "high"
  },
  "output_path": "/Users/kanggyeonggu/Documents/league-of-algologic/AGENTS/CODEX/reports/ssot-spec-audit/20260212-210456/worker_results/REL-PRODUCT-API.worker.json"
}
