{
  "run_id": "20260212-210802",
  "agent_id": "relation-auditor",
  "task_id": "REL-DESIGN-FRONTEND",
  "repo_root": "/Users/kanggyeonggu/Documents/league-of-algologic",
  "mode": "full",
  "changed_files": [],
  "target": {
    "kind": "relation",
    "id": "DESIGN_FRONTEND",
    "scope_paths": [
      "02_DESIGN",
      "05_FRONTEND"
    ],
    "checks": [
      "required_link_presence",
      "token_usage_mapping",
      "duplication_and_conflict"
    ],
    "objective": "Ensure frontend rules correctly consume design tokens and page requirements."
  },
  "severity_policy": {
    "fail_on": "high"
  },
  "output_path": "/Users/kanggyeonggu/Documents/league-of-algologic/AGENTS/CODEX/reports/ssot-spec-audit/20260212-210802/worker_results/REL-DESIGN-FRONTEND.worker.json"
}
