{
  "run_id": "20260212-210906",
  "agent_id": "agent-spec-auditor",
  "task_id": "AGENTSPEC-BACKEND",
  "repo_root": "/Users/kanggyeonggu/Documents/league-of-algologic",
  "mode": "full",
  "changed_files": [],
  "target": {
    "kind": "agent_spec",
    "id": "BACKEND_AGENT_SKILL",
    "scope_paths": [
      "AGENTS/CLAUDE/AGENTS/BACKEND",
      "AGENTS/CLAUDE/SKILLS/BACKEND",
      "AGENTS/CLAUDE/AGENTS/COMMON",
      "AGENTS/CLAUDE/SKILLS/COMMON"
    ],
    "checks": [
      "role_scope_completeness",
      "domain_mapping_completeness",
      "required_reference_existence",
      "master_subskill_wiring"
    ],
    "objective": "Validate backend agent and skill system wiring against SSOT references."
  },
  "severity_policy": {
    "fail_on": "high"
  },
  "output_path": "/Users/kanggyeonggu/Documents/league-of-algologic/AGENTS/CODEX/reports/ssot-spec-audit/20260212-210906/worker_results/AGENTSPEC-BACKEND.worker.json"
}
