{
  "run_id": "20260212-210456",
  "agent_id": "duplication-auditor",
  "task_id": "DUP-NORMATIVE",
  "repo_root": "/Users/kanggyeonggu/Documents/league-of-algologic",
  "mode": "full",
  "changed_files": [],
  "target": {
    "kind": "duplication",
    "id": "NORMATIVE_DUPLICATION",
    "scope_paths": [
      "01_PRODUCT",
      "02_DESIGN",
      "03_API",
      "04_DOMAIN",
      "05_FRONTEND",
      "06_BACKEND"
    ],
    "checks": [
      "duplicate_normative_statements",
      "conflicting_normative_statements"
    ],
    "objective": "Find duplicated or conflicting normative rules across SSOT areas."
  },
  "severity_policy": {
    "fail_on": "high"
  },
  "output_path": "/Users/kanggyeonggu/Documents/league-of-algologic/AGENTS/CODEX/reports/ssot-spec-audit/20260212-210456/worker_results/DUP-NORMATIVE.worker.json"
}
