{
  "run_id": "20260212-210802",
  "agent_id": "duplication-auditor",
  "task_id": "DUP-TERMINOLOGY",
  "repo_root": "/Users/kanggyeonggu/Documents/league-of-algologic",
  "mode": "full",
  "changed_files": [],
  "target": {
    "kind": "duplication",
    "id": "TERM_CONFLICT",
    "scope_paths": [
      "01_PRODUCT",
      "02_DESIGN",
      "03_API",
      "04_DOMAIN",
      "05_FRONTEND",
      "06_BACKEND"
    ],
    "checks": [
      "term_definition_conflict",
      "alias_without_mapping"
    ],
    "objective": "Find conflicting terms and definitions across SSOT areas."
  },
  "severity_policy": {
    "fail_on": "high"
  },
  "output_path": "/Users/kanggyeonggu/Documents/league-of-algologic/AGENTS/CODEX/reports/ssot-spec-audit/20260212-210802/worker_results/DUP-TERMINOLOGY.worker.json"
}
