{
  "run_id": "20260212-210456",
  "agent_id": "area-auditor",
  "task_id": "AREA-03_API",
  "repo_root": "/Users/kanggyeonggu/Documents/league-of-algologic",
  "mode": "full",
  "changed_files": [],
  "target": {
    "kind": "area",
    "id": "03_API",
    "scope_paths": [
      "03_API"
    ],
    "checks": [
      "required_docs",
      "broken_links",
      "contract_completeness",
      "page_map_contract_alignment"
    ],
    "objective": "Validate API contract area integrity and page map alignment."
  },
  "severity_policy": {
    "fail_on": "high"
  },
  "output_path": "/Users/kanggyeonggu/Documents/league-of-algologic/AGENTS/CODEX/reports/ssot-spec-audit/20260212-210456/worker_results/AREA-03_API.worker.json"
}
