{
  "run_id": "20260212-210546",
  "agent_id": "area-auditor",
  "task_id": "AREA-01_PRODUCT",
  "repo_root": "/Users/kanggyeonggu/Documents/league-of-algologic",
  "mode": "full",
  "changed_files": [],
  "target": {
    "kind": "area",
    "id": "01_PRODUCT",
    "scope_paths": [
      "01_PRODUCT"
    ],
    "checks": [
      "required_docs",
      "broken_links",
      "ssot_scope_boundary",
      "normative_statement_clarity"
    ],
    "objective": "Validate product requirement specs are complete, linked, and not redefining other area ownership."
  },
  "severity_policy": {
    "fail_on": "high"
  },
  "output_path": "/Users/kanggyeonggu/Documents/league-of-algologic/AGENTS/CODEX/reports/ssot-spec-audit/20260212-210546/worker_results/AREA-01_PRODUCT.worker.json"
}
