{
  "run_id": "20260212-210941",
  "agent_id": "relation-auditor",
  "task_id": "REL-PRODUCT-DESIGN",
  "repo_root": "/Users/kanggyeonggu/Documents/league-of-algologic",
  "mode": "full",
  "changed_files": [],
  "target": {
    "kind": "relation",
    "id": "PRODUCT_DESIGN",
    "scope_paths": [
      "01_PRODUCT",
      "02_DESIGN"
    ],
    "checks": [
      "required_link_presence",
      "intent_to_design_mapping",
      "duplication_and_conflict"
    ],
    "objective": "Ensure product requirements and design requirements maintain explicit and non-duplicated relationships."
  },
  "severity_policy": {
    "fail_on": "high"
  },
  "output_path": "/Users/kanggyeonggu/Documents/league-of-algologic/AGENTS/CODEX/reports/ssot-spec-audit/20260212-210941/worker_results/REL-PRODUCT-DESIGN.worker.json"
}
