{
  "run_id": "20260212-210802",
  "agent_id": "relation-auditor",
  "task_id": "REL-API-BACKEND",
  "repo_root": "/Users/kanggyeonggu/Documents/league-of-algologic",
  "mode": "full",
  "changed_files": [],
  "target": {
    "kind": "relation",
    "id": "API_BACKEND",
    "scope_paths": [
      "03_API",
      "06_BACKEND"
    ],
    "checks": [
      "required_link_presence",
      "implementation_contract_mapping",
      "duplication_and_conflict"
    ],
    "objective": "Ensure backend API implementation rules align with API contract SSOT."
  },
  "severity_policy": {
    "fail_on": "high"
  },
  "output_path": "/Users/kanggyeonggu/Documents/league-of-algologic/AGENTS/CODEX/reports/ssot-spec-audit/20260212-210802/worker_results/REL-API-BACKEND.worker.json"
}
