{
  "run_id": "20260212-210906",
  "agent_id": "duplication-auditor",
  "task_id": "DUP-OWNERSHIP",
  "repo_root": "/Users/kanggyeonggu/Documents/league-of-algologic",
  "mode": "full",
  "changed_files": [],
  "target": {
    "kind": "duplication",
    "id": "OWNERSHIP_VIOLATION",
    "scope_paths": [
      "01_PRODUCT",
      "02_DESIGN",
      "03_API",
      "04_DOMAIN",
      "05_FRONTEND",
      "06_BACKEND"
    ],
    "checks": [
      "source_of_truth_violation",
      "cross_area_redefinition"
    ],
    "objective": "Find ownership violations where non-owner docs redefine another area's SSOT."
  },
  "severity_policy": {
    "fail_on": "high"
  },
  "output_path": "/Users/kanggyeonggu/Documents/league-of-algologic/AGENTS/CODEX/reports/ssot-spec-audit/20260212-210906/worker_results/DUP-OWNERSHIP.worker.json"
}
