{
  "run_id": "20260212-210941",
  "agent_id": "relation-auditor",
  "task_id": "REL-DOMAIN-API",
  "repo_root": "/Users/kanggyeonggu/Documents/league-of-algologic",
  "mode": "full",
  "changed_files": [],
  "target": {
    "kind": "relation",
    "id": "DOMAIN_API",
    "scope_paths": [
      "04_DOMAIN",
      "03_API"
    ],
    "checks": [
      "required_link_presence",
      "entity_contract_mapping",
      "duplication_and_conflict"
    ],
    "objective": "Ensure domain model and API contract references are consistent."
  },
  "severity_policy": {
    "fail_on": "high"
  },
  "output_path": "/Users/kanggyeonggu/Documents/league-of-algologic/AGENTS/CODEX/reports/ssot-spec-audit/20260212-210941/worker_results/REL-DOMAIN-API.worker.json"
}
