{
  "run_id": "20260212-213726",
  "agent_id": "relation-auditor",
  "task_id": "REL-DOMAIN-BACKEND",
  "repo_root": "/Users/kanggyeonggu/Documents/league-of-algologic",
  "mode": "full",
  "changed_files": [],
  "target": {
    "kind": "relation",
    "id": "DOMAIN_BACKEND",
    "scope_paths": [
      "04_DOMAIN",
      "06_BACKEND"
    ],
    "checks": [
      "required_link_presence",
      "domain_rule_usage_mapping",
      "duplication_and_conflict"
    ],
    "objective": "Ensure backend rules correctly reference domain model SSOT."
  },
  "severity_policy": {
    "fail_on": "high"
  },
  "output_path": "/Users/kanggyeonggu/Documents/league-of-algologic/AGENTS/CODEX/reports/ssot-spec-audit/20260212-213726/worker_results/REL-DOMAIN-BACKEND.worker.json"
}
