{
  "run_id": "20260212-210802",
  "agent_id": "area-auditor",
  "task_id": "AREA-05_FRONTEND",
  "repo_root": "/Users/kanggyeonggu/Documents/league-of-algologic",
  "mode": "full",
  "changed_files": [],
  "target": {
    "kind": "area",
    "id": "05_FRONTEND",
    "scope_paths": [
      "05_FRONTEND"
    ],
    "checks": [
      "required_docs",
      "broken_links",
      "routing_state_api_alignment",
      "anti_pattern_consistency"
    ],
    "objective": "Validate frontend architecture and rules against upstream SSOT dependencies."
  },
  "severity_policy": {
    "fail_on": "high"
  },
  "output_path": "/Users/kanggyeonggu/Documents/league-of-algologic/AGENTS/CODEX/reports/ssot-spec-audit/20260212-210802/worker_results/AREA-05_FRONTEND.worker.json"
}
